<?xml version="1.0" encoding="UTF-8"?>
<xsd:schema xmlns:xsd="http://www.w3.org/2001/XMLSchema" >

  <xsd:element name="listaSconti">
    <xsd:complexType>
      <xsd:sequence>
        <xsd:element ref="Sconto" minOccurs="0" maxOccurs="unbounded"/>
      </xsd:sequence>
    </xsd:complexType>
  </xsd:element>

  <xsd:element name="Sconto">
    <xsd:complexType>
      <xsd:sequence>
        <xsd:element  ref="Gioco" minOccurs="0" maxOccurs="unbounded"/>
      </xsd:sequence>
        <xsd:attribute name="id_tipoSconto" type="xsd:integer" use="required"/>
    </xsd:complexType>
  </xsd:element>
  
  <xsd:element name="Gioco">
    <xsd:complexType>
      <xsd:simpleContent>
      <xsd:extension base="xsd:integer">
       <xsd:attribute name="valoreSconto" type="xsd:integer" use="required"/>
       </xsd:extension>
       </xsd:simpleContent>
    </xsd:complexType>
  </xsd:element>
  
  <xsd:element name="id_gioco" type="xsd:integer" />

</xsd:schema>